{
  "$schema": "https://json-schema.org/draft/2020-12",
  "$id": "thermalnodes/construction",
  "title": "Construction",
  "description": "A fully specified building element: assembly (layer stack) + orientation + surface film resistances. Bridges the material/assembly library and the model edges. R_total [m²·K/W] = R_si + sum(e/λ) + R_se.",
  "type": "object",
  "required": ["id", "name", "assembly_id", "orientation"],
  "additionalProperties": false,
  "properties": {

    "id": {
      "type": "string",
      "examples": ["wall_vertical_pierre_40cm", "roof_horizontal_beton", "floor_slab_sol"]
    },
    "name": {
      "type": "string",
      "examples": ["Mur vertical pierre de taille 40 cm", "Toiture horizontale béton sous tuile"]
    },
    "assembly_id": {
      "type": "string",
      "description": "References an assembly by its id."
    },
    "orientation": {
      "type": "string",
      "description": "Geometric orientation — determines default surface film resistances (ISO 6946).",
      "enum": ["vertical", "horizontal_up", "horizontal_down"],
      "examples": ["vertical"]
    },
    "R_si": {
      "type": "number",
      "description": "Interior surface thermal resistance [m²·K/W]. Defaults by orientation: vertical=0.13, horizontal_up=0.10, horizontal_down=0.17 (ISO 6946).",
      "minimum": 0
    },
    "R_se": {
      "type": "number",
      "description": "Exterior surface thermal resistance [m²·K/W]. Default 0.04 for all orientations (ISO 6946).",
      "default": 0.04,
      "minimum": 0
    },
    "notes": {
      "type": "string"
    }
  }
}
